ID,Title,Location,Salary,Summary
https://kr.indeed.com/viewjob?jk=e5448ffc7d6ecf02,FPGA 플랫폼 엔지니어 (딥러닝 하드웨어 프로세서 개발),딥엑스 성남 분당구,"연봉 40,000,000원 - 100,000,000원","사용 경험(Chip Scope/SignalTap) - Language: Python/Perl, C/C++ - Vivado 또는 Synplify 또는... SignalTap) - Language: Python/Perl, C/C++..."
https://kr.indeed.com/viewjob?jk=bf8b21d14a643975,2021년 고려해운 DT 신입사원,고려해운 서울 중구,,통신·모바일·게임>빅데이터·AI(인공지능)>데이터분석|인터넷·IT·통신·모바일·게임>빅데이터·AI(인공지능)> Python|인터넷·IT·통신·모바일·게임>빅데이터·AI(인공지능)>머신러닝|인터넷·IT·통신·모바일·게임>빅데이터...
https://kr.indeed.com/viewjob?jk=4bd70fb8a220d90d,[Janssen] Data Scientist,Johnson & Johnson Family of Companies 4.2 서울,,"Expertise in one or more programming languages... R, Python or SAS. 7. Knowledge of relational database architecture..."
https://kr.indeed.com/viewjob?jk=5d586ea25719e960,[Papago] 파파고 머신러닝(컴퓨터비전) 엔지니어 체험형 인턴,네이버 서울,,"enhnacement [자격요건] · (학부/대학원) 컴퓨터비전/신호처리 관련 전공으로 재학 혹은 졸업하신 분 · Python 등의 프로그래밍 언어를 다루실 수 있는 분 · TensorFlow, PyTorch 등의 딥러닝..."
https://kr.indeed.com/viewjob?jk=c74d035d6cb58996,Vocational Training Student/Apprentice (...,SAP 4.3 서울,,even under challenging conditions Programming languages: Python Intermediate communication skills in English Preferred...
https://kr.indeed.com/viewjob?jk=7f7d386bdc47f18e,2021년 상반기 공개 [정규직/ 무기계약직/ 비정규직/ 중형선박설계사업...,한국해양과학기술원 부설 선박해양플랜트연구소 대전 유성구,,모바일·게임>빅데이터·AI(인공지능)>인공지능(AI)|인터넷·IT·통신·모바일·게임>빅데이터·AI(인공지능)> Python|인터넷·IT·통신·모바일·게임>빅데이터·AI(인공지능)>로봇모션|인터넷·IT·통신·모바일·게임>빅데이터...
https://kr.indeed.com/viewjob?jk=c98be29f8b7c8352,"데이터분석, 딥러닝 외 신입 정규직, 인턴",피디에프솔루션세미컨덕터테크놀로지코리아 성남 분당구,"연봉 35,000,000원 - 40,000,000원",모바일·게임>빅데이터·AI(인공지능)>데이터마이닝|인터넷·IT·통신·모바일·게임>빅데이터·AI(인공지능)> Python|인터넷·IT·통신·모바일·게임>빅데이터·AI(인공지능)>R|인터넷·IT·통신·모바일·게임>빅데이터·AI...
https://kr.indeed.com/viewjob?jk=44f16e94e3e6b589,"Staff Software Engineer, Maps & Navigati...",Tesla 서울,,"industry Fluency in English Proficient in one of C++, Python Experience writing and shipping customer-facing code High..."
https://kr.indeed.com/viewjob?jk=0bd906d78c95d65e,2021년도 상반기 비정규직 공개 문,한국해양과학기술원 부설 선박해양플랜트연구소 대전 유성구,,게임>빅데이터·AI(인공지능)> Python|인터넷·IT·통신·모바일·게임... 그래머>인공지능(AI)|인터넷·IT·통신·모바일·게임>응용프로그래머> Python|인터넷·IT·통신·모바일·게임>네트워크·서버·보안>UNIX·LINUX...
https://kr.indeed.com/viewjob?jk=3cb6d7a86f9740a8,Vocational Training Student/Apprentice (...,SAP 4.3 서울,,"conditions Programming languages: C or C++ expertise, SQL, Python Intermediate communication skills in English Preferred..."
https://kr.indeed.com/viewjob?jk=e8a4630bec0783e8,2021 Market Data Analyst - Seoul,Bloomberg 서울,,"work experience using one more programming language... Python, SQL and R Fluency in Korean and English (both spoken..."
https://kr.indeed.com/viewjob?jk=68816ff0fb2a90dd,2021년 5월 첨단소재사업본부 신입사원 수시,LG화학 익산 익산시,,"공장 예지 보전 시스템 개발 - 검사 설비 자동화 및 고도화 ※우대사항 : 프로그래밍 언어 능통자(C++, Python 등) 고객 가치 제고 활동 지원 - 본부/사업부 고객가치 협의회 참여 및 지원 - 핵심 개선 과제 관리..."
https://kr.indeed.com/viewjob?jk=18aa3efc170a88cc,2021년 혁신성장 청년인재 집중양성사업 교육생 (클라우드 시스템 엔지니...,한국생산성본부 4.0 서울 중구,,게임>웹프로그래머>백엔드|인터넷·IT·통신·모바일·게임>웹프로그래머> Python|인터넷·IT·통신·모바일·게임>응용프로그래머>C#|인터넷·IT·통신... 게임>빅데이터·AI(인공지능)> Python|인터넷·IT·통신·모바일·게임...
https://kr.indeed.com/viewjob?jk=e7bbb39c4e50cf73,[디지털청년일자리 ] 인공지능 신입 개발자 (상세: 영상처리),사로리스 대구 북구,"월급 2,200,000원","직무내용] 영상처리 개발자 모집 - 언어 : Python, C++ - 상세업무 : 차량 인식 등 - 희망 전공 : 컴퓨터공학, 전자공학 관련 공학계 [근무시간 및 형태] 주 5일 근무 (오전) 9시 00분~(오후) 6시 00..."
https://kr.indeed.com/viewjob?jk=6084c350a85a4e58,Industrial Engineer - Korea,BOEING 부산,,"region. Proficiency in programming languages (ie. SQL, Python) Experience programming in Tableau or other data..."
https://kr.indeed.com/viewjob?jk=ee64abe502f8ee94,[NAVER Cloud] 가상화 코어 기술 연구 및 개발 (소프트웨어 분...,네이버 서울,,기술 개발 [ 우대사항] - Cloud에 대한 높은 이해도 - DevOps & Ansible 경험 - Python 기반 프로젝트 경험 - DPDK/XDP/OVS-DPDK 개발 경험 - Raw Socket 기반 개발 경험...
https://kr.indeed.com/viewjob?jk=088b5d4f65ea30aa,기업부설연구소 연구원,워너버스이노베이션 안산 상록구,"월급 1,830,000원",후 결정 가능 [장애인채용희망여부] 비희망 [병역특례] - 비희망 [기타 희망내용] - 프로그래밍 스킬( Python/C#/기타언어)- Computer Science에 대한 소양을 가진 분- 문제해결 능력 및 성장 마인드셋...
https://kr.indeed.com/viewjob?jk=84a8e6a4768fe82e,"Developer Relations Manager, Enterprise",NVIDIA 서울,,"R&D engineer. Familiarity... least one of C, C++, or Python. In-depth knowledge of computer systems architecture..."
https://kr.indeed.com/viewjob?jk=0c4a502533e74aac,"Research Intern, 2021",Google 4.3 서울,,"Algorithmic Foundations of Optimization. Experience with Python, C++ and other general purpose program languages. Preferred..."
https://kr.indeed.com/viewjob?jk=5a79d308be3944d6,"기술연구소 정규직 연력(Java, Python, 기타)및 개발자 (경력1...",파인씨앤아이 서울 송파구,"연봉 50,000,000원 - 60,000,000원","트웨어 개발 및 AI, 통계분석I)- 경력 : Java 개발경험 10년이상-개발언어 : Java, C++, Python, Node 등 [근무시간 및 형태] 주 5일 근무 (오전) 9시 00분~(오후) 6시 00분 주소정근로시..."
https://kr.indeed.com/viewjob?jk=b95d00f1145e5ef3,(광주취업맛집1위)2021년도 국비 기술교육생,대한상공회의소 광주인력개발원 광주 광산구,,통신·모바일·게임>빅데이터·AI(인공지능)>데이터분석|인터넷·IT·통신·모바일·게임>빅데이터·AI(인공지능)> Python|인터넷·IT·통신·모바일·게임>빅데이터·AI(인공지능)>머신러닝|인터넷·IT·통신·모바일·게임>빅데이터...
https://kr.indeed.com/viewjob?jk=4f2835fd73c9e3c7,Application Engineer III - (E3),Applied Materials Inc. 대한민국,,"trainer. 7. Direct experience of algorithm writing (e.g., R, Python... plus. 8. Travel to international locations at ~25..."
https://kr.indeed.com/viewjob?jk=9acc17c535b42959,2021년 (신입) 전문연구요원 모집,NHN 4.4 성남 판교역,,"병역특례 전문연구요원 - Python/C++/Java/C# 개발 경험... 유연한 사고와 원활한 커뮤니케이션 능력 우대 - C/C++, Python 등 개발 숙련자 우대 공통지원자격(필수) - 해당 분야 석사 이상..."
https://kr.indeed.com/viewjob?jk=dfb20fa220f3c478,"빅데이터, 인공지능(AI) 외 신입/경력 인턴",스칼라웍스 대한민국,,인공지능)>인공지능(AI)|인터넷·IT·통신·모바일·게임>빅데이터·AI(인공지능)>데이터분석|인터넷·IT·통신·모바일·게임>빅데이터·AI(인공지능)> Python|인터넷·IT·통신·모바일·게임>빅데이터·AI(인공지능)>딥러닝
https://kr.indeed.com/viewjob?jk=e7c8c2b11f24fb43,Software Engineer,Google 4.3 서울,,"languages, including... limited to: C++, Java, C and Python. Excellent written and verbal communication skills. About..."
https://kr.indeed.com/viewjob?jk=a2bae5598f01349a,Senior Solutions Consultant - South Kore...,Cloudera 서울,,"Familiarity with scripting tools... bash shell scripts, Python... Perl, Ansible, Chef, Puppet Solid background..."
https://kr.indeed.com/viewjob?jk=55584c627df1acaa,데이터 분석가/사이언티스트(신입/인턴 가능),쏘카 제주도 제주,,"Sheet) 등 데이터 분석 도구를 원활히 다루시거나, 앞으로 원활히 다루고자 하는 의지가 높으신 분 • Python, R 등의 프로그래밍 언어 혹은 데이터 분석 언어를 1개 이상 능숙하게 사용 가능하신 분 전형절차 서류..."
https://kr.indeed.com/viewjob?jk=464ad076ec3e1fa0,CHC – Business intelligence - TOM_2136,Sanofi 4.1 서울,,"degree in related field Business-level experience with R, Python Experience owning the analytics and performance of a large..."
https://kr.indeed.com/viewjob?jk=d17da0baecf05910,데이터 분야 경력,LG CNS 3.7 서울,,"해가 뛰어난 자 - R, Python, SAS, SQL 등 활용 역량 우대사항(해당 내용 중 1개 이상) - ML/DL 경험 인력 우대 - 관련 분야 석사 이상 학위 소지자 우대 - R, Python등 데이터분석 모델링 경험..."
https://kr.indeed.com/viewjob?jk=2b9e604e63e7e46d,[카카오커머스] 기술직군,카카오커머스 성남 분당구,,"우대사항 - 전자금융 감독규정, PCIDSS에 대한 실무 경험이나 이해도가 높으신 분 - JAVA, Python, shell script 등 개발 역량을 갖추신 분 - 웹/앱 취약점 진단 및 모의해킹 역량을 갖추신..."
https://kr.indeed.com/viewjob?jk=37d376a03259d4bf,"웹개발, Python 외 경력 정규직",헬스브리즈 서울 금천구,"연봉 35,000,000원 - 50,000,000원","어감. (주)헬스브리즈 웹개발, Python 외 경력 정규직 채용 모집부문... 웹개발자기타: 개발도구- Python을 주로 활용하여 Microservice Architecture를 구축- Python 이외 .NET 을 이용한..."
https://kr.indeed.com/viewjob?jk=db26147e9223e38a,[L'Oreal Korea] IT Business Analyst,L'Oreal 4.1 서울,,"outcomes Proficiency in SQL Proficiency... least one of Python (preferred), Java, or C++ Strong understanding and hands..."
https://kr.indeed.com/viewjob?jk=a90149f37643a0a8,2021년 5월 경력사원 (DX),LG에너지솔루션 서울특별시,,"Data 분석/AI를 활용한 개선 PJT 기획 및 운영 경력 - R/ Python 등 관련 프로그래밍 역량 우대사항 - 영어 능통자 - 빅데이터 분석... Project 수행 경험 - R, Python, Keras, C# 등..."
https://kr.indeed.com/viewjob?jk=6fac11c5a8fa9b96,검사 자동화 및 검사AI 분야 경력사원,LG이노텍 4.1 경기도 평택,,"C++,Labview, R, Python 등 ) - AI 관련학과 전공 및 검사공정 AI 경력 3년이상 보유자 (딥러닝 모델설계/학습/배포, 딥러닝 성능 개선 ) - Python 언어와 딥러닝 프레임워크 (Tensorflow..."
https://kr.indeed.com/viewjob?jk=70e41338b8e01711,도헌디지털의료혁신연구소 채용 공고,한림대학교성심병원 대한민국,,"활용한 분석코드 작성 클라우드 플랫폼 활용 관련업무 학사이상 학위 취득자 NoSQL, Oracle, R, Python 가능자 우대 Common Data Model 경험자 우대 서버관리/정보보안, 텍스트마이닝 경험자 우대..."
https://kr.indeed.com/viewjob?jk=59db18a2366b2c92,AI 분야 석/박사,LG CNS 3.7 서울,,"이상 (AI 관련 논문 발표) ② AI/딥러닝 알고리즘 연구개발 프로젝트 경험 ③ Ubuntu Linux, Python, Tensorflow, PyTorch 사용 중상급 이상 우대사항(해당 내용 중 1개 이상) ① AI/머신..."
https://kr.indeed.com/viewjob?jk=3d0cc83899a9b37f,[개발]CI/CD 엔지니어(정규직),위메프 2.8 대한민국,,"배포 경험이 있는 분 [우대사항] - kubernetes 기반 서비스 운영경험이 있는 분 - JAVA, python 등 웹어플리케이션용 개발언어 1개 이상 경험이 있는 분 - 네트워크, 리눅스 기반 관련 지식 보유한 분..."
https://kr.indeed.com/viewjob?jk=d3ac335d6e4ac178,연구소 개발부문 연구원 직원 (회로설계/하드웨어설계/머신비전/이미지프로세...,모든 경기도 광명,"연봉 42,000,000원 - 46,000,000원","프로그래밍 가능자 우대S/W 설계 부문 : - OPEN CV, TENSORFLOW, YOLO, CUDA/ Python, C++, C WindowsGUL APL, MFC Lib 활용 가능자. 머신비전/ 영상처리 개발자* 전기..."
https://kr.indeed.com/viewjob?jk=287bcb6bc41d726d,[세종] IT 프로젝트 웹개발자 - 단기 근로자(2개월),시야인사이트 대한민국,"월급 2,200,000원 - 2,400,000원","기타 담당업무 * Spring, Jsp 등 기술 경험 보유한 웹개발자 또는 해당 기술에 관심이 많은 자 ( Python, C# 사용 가능자 우대) - 1. 웹/솔루션 개발, 2. JAVA / Servlet / JSP 개발, 3..."
https://kr.indeed.com/viewjob?jk=595b1cfdcdf8a72a,2021 신입사원 IT분야,위세아이텍 성남 분당구,,구성을 위한 데이터마트 설계 및 개발 - 인공지능 기반 예측 모델개발 - 인공지능 기반 응용 서비스개발 - Python 기반의 데이터 분석 및 예측모델 개발 경험 보유 (우대사항) - 정보처리기사 자격보유자 - 빅데이터 공모...
https://kr.indeed.com/viewjob?jk=2e274d8c121c2d25,2021년 5월 첨단소재사업본부 R&D 신입사원 수시 (석사),LG화학 서울 강서구,,"공장 예지 보전 시스템 개발 - 검사 설비 자동화 및 고도화 ※우대사항 : 프로그래밍 언어 능통자(C++, Python 등) 1) 석사 학위자 또는 학위 취득 예정자 (’21년 7월 1일 입사 가능한 자) 2) 해외여행에 결격..."
https://kr.indeed.com/viewjob?jk=1806287902a1a36e,[데이터센터] (경력/신입) 카카오 데이터센터 Data Scientist...,카카오 4.0 성남 판교역,,"않고, 기술이 비즈니스 가치로 변모할 수 있는 그 가능성에 집중합니다. 지원자격 필수사항 Go, Python, Scala, Java, C/C++ 중 하나 이상의 언어에 능숙하신 분 SQL 또는 HiveQL에 능숙하신..."
https://kr.indeed.com/viewjob?jk=add880a19f345249,"Customer Engineer, Machine Learning, Goo...",Google 4.3 서울,,"Caffe, as well as numerical programming frameworks... Python or MATLAB. Preferred qualifications: Master's degree..."
https://kr.indeed.com/viewjob?jk=6dd6df0289d55d06,Support Engineer,Microsoft 4.2 서울,,"script-based development environments and tools (PERL, Python, Ruby, PhP, etc.) • Experience in Core Linux administration..."
https://kr.indeed.com/viewjob?jk=2bc89fb4b05a2c88,[특허톤 참가자격/관련분야 취업연계] 2021년 빅데이터 전문가 양성과정...,한국여성과학기술인지원센터 서울 서대문구,,통신·모바일·게임>웹프로그래머> Python|인터넷·IT·통신·모바일·게임... 데이터분석|인터넷·IT·통신·모바일·게임>빅데이터·AI(인공지능)> Python|인터넷·IT·통신·모바일·게임>빅데이터·AI(인공지능)>머신러닝|인터넷...
https://kr.indeed.com/viewjob?jk=54e0d08c99dcf507,MI(Market Intelligence)담당 마케팅 전략 경력사원,LG전자 3.8 서울 영등포구,,"마케팅 전략/방향성 도출 경험 보유 4) 우대 사항 - 통계 분석 및 프로그래밍 언어 역량 보유: R, python, Java, SPSS, Tableau, etc. - 영어 능통 역량: 해외법인과 영어 화상 회의 및 현지..."
https://kr.indeed.com/viewjob?jk=d8d8801a2da78488,Python 신입/경력 알바,매직에코 서울 강남구,"시급 12,000원",23시59분까지 접수방법: bit.ly/CODEMATE1기지원접수양식: 자사양식 기타 유의사항 입사지원서 및 제출서류에 허위사실이 있을 경우 채용이 취소될 수 있습니다. 인터넷·IT·통신·모바일·게임>웹프로그래머> Python
https://kr.indeed.com/viewjob?jk=70e41338b8e01711,도헌디지털의료혁신연구소 채용 공고,한림대학교성심병원 대한민국,,"활용한 분석코드 작성 클라우드 플랫폼 활용 관련업무 학사이상 학위 취득자 NoSQL, Oracle, R, Python 가능자 우대 Common Data Model 경험자 우대 서버관리/정보보안, 텍스트마이닝 경험자 우대..."
https://kr.indeed.com/viewjob?jk=7cb5c3076d1701db,"Field Applications Engineer, Audio",Dolby 서울,,"High level or detailed knowledge of SOC design. C/C++, python coding skills. Knowledge of music, audio/video production..."
https://kr.indeed.com/viewjob?jk=c3fe1cbc5e1ae20b,Technical Support Representative(사원급),IBM 3.9 서울,,"k8s, Cloud, Dev/Ops 등 최신 IT 기술에 대한 학습 및 구현 경험 • Java, Python 등을 활용한 오픈소스 관련 개발 경험 Required Technical and Professional..."
https://kr.indeed.com/viewjob?jk=2bbaaacb445f9911,2021-1회 데이터사이언스그룹 박사후연구원,기초과학연구원 대전,,"PNAS, Science, Nature), 다음의 분석언어와 도구를 하나 이상 능숙하게 다룰 수 있는 자( Python/R/Scala/Scikit-learn/Spark/TensorFlow/PyTorch) ㅇ 인원: 4명..."
https://kr.indeed.com/viewjob?jk=8f2594c778f57b5f,【일본/미나토구 근무】게임 운영 회사 데이터 애널리스트【프로젝트 관리 경험 2년 이상】,株式会社ネクソン 대한민국,,ィストとしてのプロジェクト管理経験2年以上 ・大学(四年制大学、専門学校)のデータベース系や統計学部を卒業した方 ・ Python、R、SQLの使用経験(使用経験とは、分析モデルを作りそれを使って分析ができるレベル) ・データ収集、加工、分析及び...
https://kr.indeed.com/viewjob?jk=d8c9adea99c1bd1c,"SK M&Service 각 부문 경력직 (DBM/CRM분석 , 컨텐츠 기...",SK M&Service 서울특별시,,"추출 역량 - Web/App. Log Data 분석 역량 - SQL, R, Python을 이용한 데이터 분석 역량(SQL필수, R/ Python 선택적) - Excel 활용 및 Data Handling 역량 - 마케팅..."
https://kr.indeed.com/viewjob?jk=0b23baf70b46eb4e,에프앤가이드 - 각 부문,에프앤가이드 대한민국,,"3 ~ 7년 ㆍ 개인 대상 비즈니스 경험 ㆍ개인자산관리(PB) 경험 ㆍB2C 컨텐츠 기획 및 개발 경험 Python, R, Tensorflow, Keras 개발 가능 ㆍ머신러닝/딥러닝 관련 프로젝트 수행 경험 ㆍ자연어 처리분..."
https://kr.indeed.com/viewjob?jk=afeaf9f2fdda7973,"Engr, Apps Dev 3",KLA-Tencor 대한민국,,"working effectively with different cultures. Matlab/ Python experience is a plus. We offer a competitive, family friendly..."
https://kr.indeed.com/viewjob?jk=55584c627df1acaa,데이터 분석가/사이언티스트(신입/인턴 가능),쏘카 제주도 제주,,"Sheet) 등 데이터 분석 도구를 원활히 다루시거나, 앞으로 원활히 다루고자 하는 의지가 높으신 분 • Python, R 등의 프로그래밍 언어 혹은 데이터 분석 언어를 1개 이상 능숙하게 사용 가능하신 분 전형절차 서류..."
https://kr.indeed.com/viewjob?jk=73317adae7b3fa61,[2021인턴] AI R&D - Language AI,엔씨소프트 2.7 성남 판교역,,"발합니다. 지원자격 학력 : 전문학사 이상 필수조건 [ 이런 역량을 갖춘 NC 인턴을 찾습니다! ] - Python, Java등 한 가지 이상의 컴퓨터 프로그래밍 언어를 활용할 수 있으신 분 - 머신러닝/딥러닝 기술에 대한..."
https://kr.indeed.com/viewjob?jk=0bd906d78c95d65e,2021년도 상반기 비정규직 공개 문,한국해양과학기술원 부설 선박해양플랜트연구소 대전 유성구,,게임>빅데이터·AI(인공지능)> Python|인터넷·IT·통신·모바일·게임... 그래머>인공지능(AI)|인터넷·IT·통신·모바일·게임>응용프로그래머> Python|인터넷·IT·통신·모바일·게임>네트워크·서버·보안>UNIX·LINUX...
https://kr.indeed.com/viewjob?jk=9acc17c535b42959,2021년 (신입) 전문연구요원 모집,NHN 4.4 성남 판교역,,"병역특례 전문연구요원 - Python/C++/Java/C# 개발 경험... 유연한 사고와 원활한 커뮤니케이션 능력 우대 - C/C++, Python 등 개발 숙련자 우대 공통지원자격(필수) - 해당 분야 석사 이상..."
https://kr.indeed.com/viewjob?jk=0c4a502533e74aac,"Research Intern, 2021",Google 4.3 서울,,"Algorithmic Foundations of Optimization. Experience with Python, C++ and other general purpose program languages. Preferred..."
https://kr.indeed.com/viewjob?jk=3d0cc83899a9b37f,[개발]CI/CD 엔지니어(정규직),위메프 2.8 대한민국,,"배포 경험이 있는 분 [우대사항] - kubernetes 기반 서비스 운영경험이 있는 분 - JAVA, python 등 웹어플리케이션용 개발언어 1개 이상 경험이 있는 분 - 네트워크, 리눅스 기반 관련 지식 보유한 분..."
https://kr.indeed.com/viewjob?jk=6fac11c5a8fa9b96,검사 자동화 및 검사AI 분야 경력사원,LG이노텍 4.1 경기도 평택,,"C++,Labview, R, Python 등 ) - AI 관련학과 전공 및 검사공정 AI 경력 3년이상 보유자 (딥러닝 모델설계/학습/배포, 딥러닝 성능 개선 ) - Python 언어와 딥러닝 프레임워크 (Tensorflow..."
https://kr.indeed.com/viewjob?jk=a90149f37643a0a8,2021년 5월 경력사원 (DX),LG에너지솔루션 서울특별시,,"Data 분석/AI를 활용한 개선 PJT 기획 및 운영 경력 - R/ Python 등 관련 프로그래밍 역량 우대사항 - 영어 능통자 - 빅데이터 분석... Project 수행 경험 - R, Python, Keras, C# 등..."
https://kr.indeed.com/viewjob?jk=9ea370e5966cdd08,첨단소재사업본부 R&D(석/박사) 경력사원,LG화학 대전광역시,,"자동화 및 고도화 2. 필수사항 - 해당경력 3년 이상 3. 우대사항 - 프로그래밍 언어 능통자(C++, Python 등) - 석사 : 1년 이상 경력을 보유한 석사학위 소지자 - 박사 : 박사학위 소지자(학위 취득 예정자는..."
https://kr.indeed.com/viewjob?jk=c98be29f8b7c8352,"데이터분석, 딥러닝 외 신입 정규직, 인턴",피디에프솔루션세미컨덕터테크놀로지코리아 성남 분당구,"연봉 35,000,000원 - 40,000,000원",모바일·게임>빅데이터·AI(인공지능)>데이터마이닝|인터넷·IT·통신·모바일·게임>빅데이터·AI(인공지능)> Python|인터넷·IT·통신·모바일·게임>빅데이터·AI(인공지능)>R|인터넷·IT·통신·모바일·게임>빅데이터·AI...
https://kr.indeed.com/viewjob?jk=0224e8cd9aba5320,Network Engineer,Blizzard Entertainment 서울,,Environment and troubleshooting Linux network configuration. Python/Bash scripting experience. Bachelor’s degree in computer...
https://kr.indeed.com/viewjob?jk=818d5c4e3d4e8c76,디지털자산(암호화폐) 퀀트 트레이더 (경력),네오위즈 대한민국,,"경험이 있는 분 - 또는 운용사 및 증권회사에서 근무한 경력이 있는 분 우대사항 - 프로그래밍 능력( Python, R 등)을 보유하고, 개발해 본 경험이 있는 분 - 컴퓨터공학, 금융공학, 수학, 통계학을 전공한 분..."
https://kr.indeed.com/viewjob?jk=368e303e15b6bdb7,AI Engineer,GE Appliances 경기도 성남,,"lite, TensorRT. 5+ years of programming experience in Python, C/C++ Experiences working on deep learning model optimization..."
https://kr.indeed.com/viewjob?jk=5b60a8734b78ffce,SK 바이오팜 Digital Healthcare 경력직 (생체신호 AI...,SK 바이오팜 경기도,,"생체신호(EEG, ECG, PPG 등 Biomedical Signal) 측정 및 신호처리 연구 경력 - Python, R 등 개발 언어 사용 및 딥러닝 프레임워크(Tensorflow, Keras, PyTorch 등) 경험자..."
https://kr.indeed.com/viewjob?jk=62d6e765a010b922,【일본/미나토구 근무】게임 운영 회사 데이터 사이언티스트【한국어 필수】,株式会社ネクソン 대한민국,,求める人材: * 【必須経験】 ・機械学習や統計知識を利用した実務経験1年以上 ・プログラミングの実務経験( Python、C++、Javaのいずれか)1年以上 ・韓国語 ビジネスレベル(上級)以上 【歓迎経験】 ・ゲームの開発経験、運用経...
https://kr.indeed.com/viewjob?jk=68816ff0fb2a90dd,2021년 5월 첨단소재사업본부 신입사원 수시,LG화학 익산 익산시,,"공장 예지 보전 시스템 개발 - 검사 설비 자동화 및 고도화 ※우대사항 : 프로그래밍 언어 능통자(C++, Python 등) 고객 가치 제고 활동 지원 - 본부/사업부 고객가치 협의회 참여 및 지원 - 핵심 개선 과제 관리..."
https://kr.indeed.com/viewjob?jk=78e99625e5de3c95,전문연구요원 (병역특례) 수시 (AI / HW 분야),딥엑스 성남 분당구,"연봉 40,000,000원 - 100,000,000원","모델의 RTL IP 설계 및 IP 검증 가능자 - Language: Python/Perl, C/C++ [우대 조건] - ARM based SoC 설계... Linux, shell, tcl, python, perl 사용 원활..."
https://kr.indeed.com/viewjob?jk=11760c4c5d39123f,【일본/미나토구 근무】게임 운영 회사 데이터 애널리스트,株式会社ネクソン 대한민국,,経験】 ・ゲーム企業やIT企業でデータアナリスト / データサイエンティストとしてのプロジェクト管理経験4年以上 ・ Python、R、SQLの使用経験(使用経験とは、分析モデルを作りそれを使って分析ができるレベル) ・データ収集、加工、分析及び...
